{
  "schema_version": "local-second-wall-diagnostic/2",
  "enabled": false,
  "threshold_version": "local-second-wall-diagnostic-v2",
  "scan_step_deg": 1.0,
  "inward_search_extent_deg": 30.0,
  "outward_search_extent_deg": 30.0,
  "max_seeds_per_domain": 32,
  "max_total_search_jobs": 256,
  "max_wall_candidates": 32,
  "min_wall_separation_deg": 2.0,
  "max_wall_separation_deg": 30.0,
  "max_parallel_difference_deg": 25.0,
  "max_endpoint_circle_residual_px": 0.5,
  "min_radial_coverage": 0.6,
  "max_radial_coverage_difference": 0.2,
  "min_opening_dark_fraction": 0.7,
  "opening_sample_angles": 9,
  "opening_sample_radii": 9,
  "candidate_merge_deg": 0.5
}
